{
 "$schema":"https://json-schema.org/draft/2020-12/schema","$id":"urn:offline-tools:automation-run-receipt:1","type":"object","required":["schema_version","run_id","workflow","state","started_at_utc","inputs","controls","outputs"],
 "properties":{"schema_version":{"const":"1.0"},"run_id":{"type":"string"},"workflow":{"type":"string"},"state":{"enum":["completed","failed","cancelled","waiting_for_user","waiting_for_approval"]},"started_at_utc":{"type":"string"},"completed_at_utc":{"type":["string","null"]},"inputs":{"type":"array"},"mapping_version":{"type":["string","null"]},"calculation_version":{"type":["string","null"]},"idempotency_key":{"type":["string","null"]},"controls":{"type":"array","items":{"type":"object","required":["id","status"],"properties":{"id":{"type":"string"},"status":{"enum":["passed","failed","warning","not-applicable"]},"evidence":{"type":["string","null"]}}}},"outputs":{"type":"array"},"warnings":{"type":"array"},"approvals":{"type":"array"}},"additionalProperties":true
}
